{
  "$schema": "https://json-schema.org/draft/2020-12/schema",
  "$id": "https://aisus.dev/schemas/sequence.schema.json",
  "title": "aisus sequence map",
  "description": "One flow through a repository's code. Participants are the code that takes part, messages are the calls between them in the order they happen, and the viewer derives every position from that order.",
  "type": "object",
  "additionalProperties": false,
  "required": ["schema_version", "diagram_type", "meta", "participants", "messages"],
  "properties": {
    "schema_version": { "const": 1 },
    "diagram_type": { "const": "sequence" },
    "meta": {
      "type": "object",
      "additionalProperties": false,
      "required": ["title", "output"],
      "properties": {
        "title": { "type": "string", "minLength": 1 },
        "subtitle": { "type": "string" },
        "output": { "type": "string", "minLength": 1, "pattern": "[.]html$" },
        "locale": { "type": "string", "pattern": "^[a-z]{2,3}(-[A-Za-z0-9]{2,8})*$" },
        "quality_profile": { "enum": ["standard", "showcase"] },
        "repository": {
          "type": "object",
          "additionalProperties": false,
          "required": ["url", "revision"],
          "properties": {
            "url": { "type": "string", "minLength": 1 },
            "revision": { "type": "string", "pattern": "^[0-9a-fA-F]{40}$" },
            "provider": { "enum": ["github", "gitee"] },
            "link_mode": { "enum": ["web", "local-only"] }
          }
        }
      }
    },
    "participants": {
      "type": "array",
      "minItems": 2,
      "items": {
        "type": "object",
        "additionalProperties": false,
        "required": ["id", "type", "label"],
        "properties": {
          "id": { "$ref": "#/$defs/id" },
          "type": { "enum": ["frontend", "backend", "database", "cloud", "security", "messagebus", "external"] },
          "label": { "type": "string", "minLength": 1 },
          "sublabel": { "type": "string" },
          "sources": { "$ref": "#/$defs/sources" }
        }
      }
    },
    "messages": {
      "type": "array",
      "minItems": 1,
      "items": {
        "type": "object",
        "additionalProperties": false,
        "required": ["id", "from", "to", "label"],
        "properties": {
          "id": { "$ref": "#/$defs/id" },
          "from": { "$ref": "#/$defs/id" },
          "to": { "$ref": "#/$defs/id" },
          "label": { "type": "string", "minLength": 1 },
          "variant": { "enum": ["default", "emphasis", "security", "dashed", "return"] },
          "note": { "type": "string", "minLength": 1 },
          "sources": { "$ref": "#/$defs/sources" }
        }
      }
    },
    "phases": {
      "type": "array",
      "items": {
        "type": "object",
        "additionalProperties": false,
        "required": ["label", "first", "last"],
        "properties": {
          "label": { "type": "string", "minLength": 1 },
          "first": { "$ref": "#/$defs/id" },
          "last": { "$ref": "#/$defs/id" }
        }
      }
    }
  },
  "$defs": {
    "id": { "type": "string", "pattern": "^[a-zA-Z][a-zA-Z0-9_-]*$" },
    "sources": {
      "type": "array",
      "minItems": 1,
      "maxItems": 3,
      "items": {
        "type": "object",
        "additionalProperties": false,
        "required": ["path"],
        "properties": {
          "path": { "type": "string", "minLength": 1, "maxLength": 240 },
          "line": { "type": "integer", "minimum": 1 },
          "end_line": { "type": "integer", "minimum": 1 },
          "label": { "type": "string", "minLength": 1, "maxLength": 48 }
        }
      }
    }
  }
}
